{
  "entry_id": "urn:uuid:00000004-0000-4000-8000-000000000004",
  "receipt_hash": "sha256:42f7fee05bd7c45fc7480aafcdd4b6fac6df88f5bff57d07cb015455d0c912cf",
  "state": "settled",
  "amount": {
    "amount": "0.072",
    "currency": "USD"
  },
  "payout_tier": "slo_met",
  "seller_aid": "arc:mkt.example:7K3MQ9P2XXTR84MN",
  "capability": "invoice-data-extraction",
  "taxonomy_node": "arc.document.extraction.invoice",
  "engagement_ref": "sha256:13151606c657c1e3a3aa487a5adedefeb1d416d6434aca07dbae7e34bd4f1a85",
  "allocation": {
    "cost_center": "FIN-OPS-114",
    "project": "ap-automation",
    "workflow_id": "wf-88"
  },
  "event_time": "2026-08-25T10:31:10Z"
}
